{
  "analysisId": "public-local-0.1.0-2026-10-27",
  "createdAt": "2026-10-27T21:38:49.194624+00:00",
  "excludedExecutions": [],
  "includedExecutions": [
    "20261026T053308Z-s01-652aa247",
    "20261026T053324Z-s01-a75e6182",
    "20261026T053340Z-s01-b8aafeb6",
    "20261026T053356Z-s01-573b8911",
    "20261026T053413Z-s01-7fc894ff",
    "20261026T053429Z-s01-573413d5",
    "20261026T053446Z-s01-5d041056",
    "20261026T053502Z-s01-824bde96",
    "20261026T053519Z-s01-5699a757",
    "20261026T053535Z-s01-d9d93602",
    "20261026T053551Z-s01-ffea69c4",
    "20261026T053608Z-s01-0445b46e",
    "20261026T053624Z-s01-ae8b1e47",
    "20261026T053641Z-s01-c248a433",
    "20261026T053657Z-s01-3a849b25",
    "20261026T053713Z-s01-1ae35769",
    "20261026T053729Z-s01-b9b1afec",
    "20261026T053745Z-s01-69049466",
    "20261026T053802Z-s01-0e194b1d",
    "20261026T053818Z-s01-2f754e46",
    "20261026T053834Z-s01-04e79d79",
    "20261026T053850Z-s01-1637a51f",
    "20261026T053906Z-s01-35785f0a",
    "20261026T053922Z-s01-a6f84f47",
    "20261026T053938Z-s01-64d3c106",
    "20261026T053954Z-s01-d5839359",
    "20261026T054011Z-s01-9f686ff3",
    "20261026T054027Z-s01-badebb70",
    "20261026T054043Z-s01-6e8511d9",
    "20261026T054059Z-s01-5eafbe7c",
    "20261026T054115Z-s02-285ce346",
    "20261026T054247Z-s02-f0854781",
    "20261026T054417Z-s02-b60d580e",
    "20261026T054858Z-s03-03213b64",
    "20261026T054933Z-s03-be400f42",
    "20261026T055008Z-s03-0d43a733",
    "20261026T055043Z-s03-c16f6ba3",
    "20261026T055118Z-s03-fd7f5983",
    "20261026T055153Z-s03-fdef8caf",
    "20261026T055228Z-s03-f8418665",
    "20261026T055304Z-s03-dc05d40a",
    "20261026T055339Z-s03-c710b4b4",
    "20261026T055414Z-s03-c8189191",
    "20261026T055449Z-s03-d96a16f0",
    "20261026T055524Z-s03-989257a6",
    "20261026T055559Z-s03-f7c3aaab",
    "20261026T055634Z-s03-5c1c492e",
    "20261026T055709Z-s03-1bd7f4b8",
    "20261026T055744Z-s03-d3a51177",
    "20261026T055819Z-s03-8e67a8ca",
    "20261026T055855Z-s03-91d242b9",
    "20261026T055930Z-s03-55b54886",
    "20261026T060005Z-s03-0fd74490",
    "20261026T060040Z-s03-84d44013",
    "20261026T060115Z-s03-c847bb68",
    "20261026T060150Z-s03-782b76cb",
    "20261026T060225Z-s03-057a9db2",
    "20261026T060300Z-s03-c2ef4f25",
    "20261026T060335Z-s03-6a1533ae",
    "20261026T060410Z-s03-2b83216c",
    "20261026T060445Z-s03-d5b500de",
    "20261026T060520Z-s03-df6689fd",
    "20261026T060556Z-s03-b9cf438a",
    "20261026T060631Z-s04-f1106937",
    "20261026T060645Z-s04-d6bdbcb2",
    "20261026T060658Z-s04-0f1249d3",
    "20261026T060712Z-s04-aa30023e",
    "20261026T060726Z-s04-0707ad6e",
    "20261026T060740Z-s04-e50a033c",
    "20261026T060754Z-s04-75347a01",
    "20261026T060808Z-s04-d00ca73e",
    "20261026T060821Z-s04-ff68e5dc",
    "20261026T060835Z-s04-159d69e0",
    "20261026T060849Z-s04-4dfc5dd6",
    "20261026T060903Z-s04-0f351bab",
    "20261026T060916Z-s04-c511c08c",
    "20261026T060930Z-s04-ba8d4ff7",
    "20261026T060943Z-s04-900ecdfe",
    "20261026T060957Z-s04-6d00ea5b",
    "20261026T061011Z-s04-00269cea",
    "20261026T061024Z-s04-28ca53bd",
    "20261026T061038Z-s04-7f4cf3b2",
    "20261026T061052Z-s04-cdbbf0b1",
    "20261026T061106Z-s04-e3d75bea",
    "20261026T061119Z-s04-78f5b0c9",
    "20261026T061133Z-s04-c4991bbb",
    "20261026T061147Z-s04-15acb949",
    "20261026T061200Z-s04-568ec895",
    "20261026T061214Z-s04-e509de03",
    "20261026T061228Z-s04-830553bd",
    "20261026T061241Z-s04-30de6963",
    "20261026T061255Z-s04-c737a23d",
    "20261026T061309Z-s04-6206d29d",
    "20261026T061323Z-s07-d1a2185d",
    "20261026T061323Z-t01-4e841c4c",
    "20261026T061324Z-t02-1c85252c",
    "20261026T061324Z-t04-cd6d587e",
    "20261026T061324Z-t09-972594f9",
    "20261026T061324Z-t10-7e11c91b",
    "20261026T061325Z-d01-b20a23bd",
    "20261026T061326Z-d02-b82cd01c",
    "20261026T061326Z-d03-9e2a8dad",
    "20261026T061327Z-d04-dde0ba0a",
    "20261026T061327Z-d05-9c561f32",
    "20261026T061327Z-d08-a3a98978",
    "20261026T061327Z-d11-cfe1dc02",
    "20261026T062111Z-s05-377680b2",
    "20261026T062112Z-s06-c7b71597",
    "20261026T062112Z-s08-fcd04a3e",
    "20261026T062113Z-d06-3ef13f43",
    "20261026T062113Z-t03-78b85420",
    "20261026T062113Z-t05-e5170470",
    "20261026T062113Z-t06-0e9048be",
    "20261026T062113Z-t07-fa88fcda",
    "20261026T062122Z-d07-e85beb7f",
    "20261026T062126Z-d10-d011e7db"
  ],
  "method": "Frozen confirmatory analysis with pilot, superseded, and remediation runs kept separate.",
  "outputs": {
    "analysis_json": "analysis.json",
    "checksums": "checksums.sha256",
    "findings_md": "findings.md",
    "hypothesis_verdicts_json": "hypothesis-verdicts.json",
    "hypothesis_verdicts_md": "hypothesis-verdicts.md",
    "measurements_csv": "measurements.csv",
    "statistics_csv": "statistics.csv"
  },
  "schemaVersion": 1,
  "software": {
    "pulsecrawl": "0.1.0",
    "python": "3.11.9"
  }
}
